url,question,context,answer
https://www.xacbank.mn/product/54,ГАДААД РУУ МӨНГӨ ГУЙВУУЛАХ ТАНЫ БОДСОНООС Ч ХЯЛБАР,S.W.I.F.T,"Бид харилцагчиддаа дэлхийн аль ч улс руу төлбөр шилжүүлэх үйлчилгээг гэрээсээ, албан тасалгаанаасаа, гар утаснаасаа, эсхүл ХасБанкны Улаанбаатар хот болон 21 аймагт байрлах бүх салбар нэгжүүдээрээ дамжуулан хэдхэн хормын дотор авах боломжийг олгож байна.
No link found. Check URL: https://www.xacbank.mn/product/54"
https://www.xacbank.mn/product/54,"Онцлог, давуу талууд",S.W.I.F.T,"Төлбөр тооцоог хамгийн өргөн сүлжээ бүхий S.W.I.F.T сүлжээгээр дамжуулан түргэн шуурхай, найдвартай хийнэ..
Хамгийн түгээмэл хэрэглэгддэг 11 төрлийн гадаад валютаар төлбөр гүйцэтгэнэ. Үүнд:USD,EUR,CNY,JPY,KRW,AUD,GBP,CAD,HKD,SGD..
ХасБанкны Улаанбаатар хот болон 21 аймагт байрлах 100 гаруй салбар, нэгжээс үйлчилгээ авах, гуйвуулга хийх..
Интернэт, мобайл банкны үйлчилгээг ашиглан гэрээсээ, албан тасалгаанаасаа, хүссэн газраасаа гүйлгээ хийх..
Гуйвуулга шилжүүгийн талаар лавлагаа, мэдээлэл авах..
Шимтгэл хураамж өрсөлдөхүйц.."
https://www.xacbank.mn/product/56,Анхаарах зүйлс,Гадаад руу мөнгө гуйвуулах,"Төлбөрийн даалгаварт төлбөр хүлээн авагчийн банкны мэдээлэл, дансны дугаар, дэлгэрэнгүй хаяг, утасны дугаар болон гүйлгээний утга зэргийг үнэн зөв, гаргацтай бөглөх. Алдаатай, буруу эсхүл дутуу бөглөсний улмаас гуйвуулга саатах эсхүл буцаагдах магадлалтайг анхаарна уу..
БНХАУ-руу Юань гуйвуулах бол хүлээн авагчийн нэр, банкны мэдээллийг ХАНЗ бичлэгээр авчрах. Зөвхөн Эрээн хотын салбар эсхүл Хятадын Хөдөө Аж Ахуйн Банкны картын дансруу мөнгө шилжүүлэх тохиолдолд дээр дурьдсан мэдээллүүдийг ханзаар авчрах шаардлагагүй..
Европ болон Карибын улсууд руу Евро шилжүүлэх тохиолдолд IBAN дугаарыг бичих шаардлагатай..
Хэрэв бараа бүтээгдэхүүн бол бараа бүтээгдэхүүний нэхэмжлэлийн хуулбар.."
https://www.xacbank.mn/product/58,Биет хөрөнгийг даатгуулахад тавигдах шаардлага,Эд хөрөнгийн даатгал,"Өмчлөгч эзэмшигч нь тодорхой байх..
Зах зээлийн үнэ тодорхойлогдохуйц байх..
Бусад хөрөнгөөс ялгагдах дахин давтагдахгүй сериал дугаар, онцлогтой байх.."
https://www.xacbank.mn/product/58,Биет хөрөнгөнд учрах боломжит эрсдэлүүд,Эд хөрөнгийн даатгал,"Бүх төрлийн гал болон дэлбэрэлтийн..
Бүх төрлийн байгалийн..
Цахилгаан эрчим хүчний хэлбэлзэлийн..
Сантехникийн..
Хулгай дээрмийн..
Гуравдагч этгээдийн санаатай болон санамсаргүй үйлдлийн..
Ахуйн..
Далд гэмтлийн.."
https://www.xacbank.mn/product/58,Шаардлагатай бичиг баримтын жагсаалт,Эд хөрөнгийн даатгал,"Өмчлөгч, эзэмшигчийн мэдээлэл - Иргэний үнэмлэх, Байгууллагын гэрчилгээ..
Хөрөнгийн гэрчилгээ, бичиг баримт..
Хөрөнгийн нэр, марк, серийн дугаар болон бусад шаардлагатай мэдээллүүд..
Хөрөнгийн зах зээлийн үнэлгээ, эсвэл худалдан авсан санхүүгийн баримт**.."
https://www.xacbank.mn/product/58,Нөхөн төлбөрийн тохиолдолд бүрдүүлэх материалын жагсаалт,Эд хөрөнгийн даатгал,"Даатгуулагчийн өргөдөл..
Холбогдох эрх бүхий байгууллагын дүгнэлт. (Жишээ нь: СӨХ, Конторын дүгнэлт г.м)..
Хохирлын үнэлгээний тайлан..
Даатгалын гэрээ, гэрээт баталгааны эх хувь..
Бусад шаардлагатай материал.."
https://www.xacbank.mn/product/59,Авто тээврийн хэрэсэлд учрах боломжит эрсдэлүүд,Авто тээврийн хэрэгслийн даатгал,"Тээврийн хэрэгслийн осол..
Гуравдагч этгээдийн санаатай үйлдэл..
Сантехникийн эрсдэл..
Галын эрсдэл..
Байгалийн хүчний үйлчлэл..
Хулгай дээрэм..
Жолоочийн гэнэтийн осол.."
https://www.xacbank.mn/product/59,Шаардлагатай бичиг баримтын жагсаалт,Авто тээврийн хэрэгслийн даатгал,"Өмчлөгч, эзэмшигчийн мэдээлэл - Иргэний үнэмлэх, Байгууллагын гэрчилгээ..
Тээврийн хэрэгслийн гэрчилгээ, бичиг баримт..
Тээврийн хэрэгслийн нэр, марк, серийн дугаар болон бусад шаардлагатай мэдээллүүд..
Хөрөнгийн зах зээлийн үнэлгээ, эсвэл худалдан авсан санхүүгийн баримт**.."
https://www.xacbank.mn/product/59,Нөхөн төлбөрийн тохиолдолд бүрдүүлэх материалын жагсаалт,Авто тээврийн хэрэгслийн даатгал,"Даатгуулагчийн өргөдөл..
Холбогдох эрх бүхий байгууллагын дүгнэлт. (Жишээ нь, ЗЦГ-ын ослын дүгнэлт)..
Хохирлын үнэлгээний тайлан..
Даатгалын гэрээ, гэрээт баталгааны эх хувь..
Холбогдогч жолооч нарын иргэний үнэмлэх, жолооны үнэмлэх болон тээврийн хэрэгслүүдийн гэрчилгээний хуулбар..
Бусад шаардлагатай материал.."
https://www.xacbank.mn/product/6,Давуу тал,Харилцах,"Дансандаа зээлийн эрх үүсгүүлэх..
Дотоод шилжүүлэг хийх, төлбөр хүлээн авах..
Төрөл бүрийн валютын арилжаа хийх..
Захиалгат шилжүүлэг буюуСтэндинг ордерүйлчилгээ авах..
Цахим банкны үйлчилгээнд бүртгүүлж, банкинд ирэхгүйгээр интернет, гар утас ашиглан дансны үлдэгдлээ шалгах, гүйлгээ хийж, өөрийн дансаа удирдах, хянах боломжтой.."
https://www.xacbank.mn/product/6,Бүтээгдэхүүний нөхцөл,Харилцах,"Дансны доод үлдэгдэл, -, -, -, 250, 1,000, 10, 10, 10, 10, 20,000
Данс хөтөлсний шимтгэл (сар бүр), -, -, -, 25, 80, 5, 1, 1, 1, 1,000
Данс нээх хураамж, Хураамжгүй
Данс хаах хураамж, 3,000₮"
https://www.xacbank.mn/product/6,"бусад шимтгэл, хураамж",Харилцах,"Орлогын гүйлгээ, Бэлэн бус орлого, Шимтгэлгүй
Бэлэн орлого, Шимтгэлгүй, 0.20%, Зөвхөн бэлэн бусаар хийнэ, 20%, 1.50%, 0.30%
Бэлэн бусаар шилжүүлэг хийх, Цахим суваг ашиглан хийх ХасБанкны данс хоорондын гүйлгээ, Шимтгэлгүй
Салбарт хийгдэх ХасБанкны данс хоорондын гүйлгээ, 100₮
Банк хоорондын гүйлгээ, 200*, 1, 0.5, 1,000₮, -, -, -, -, -, -
Бэлэн зарлагын гүйлгээ**, Бэлнээр тушаасан орлогоос бэлнээр гаргахад, 200 төгрөг, 0-10,000 USD түүнтэй тэнцэх - 5,000 төгрөг10,000-100,000 USD түүнтэй тэнцэх - 10,000 төгрөг100,000 USD-с дээш түүнтэй тэнцэх - 20,000 төгрөг
Бэлэн бусаар шилжүүлсэн орлогоос бэлнээр гаргахад1, 200, 0.30%, 0.50%, 0.50%, 0.50%, -, -, 2.00%, 2.00%, 0.50%
Бэлэн мөнгө тушаах, бусад банк руу шилжүүлэг хийх, 2,000 төгрөг
Залруулга гүйлгээ****, 500 төгрөг
Тодорхойлолт***, 5,000 төгрөг
Хуулга, Цахим шуудангаар илгээхэд, Шимтгэлгүй
Хэвлэж өгөхөд 1 хуудасны үнэ, 100 төгрөг
Лавлагаа, 1 жилийн доторх баримтаас, 10,000 төгрөг
1 жилээс дээшхи хугацааны баримтаас, 20,000 төгрөг
Идэвхгүй дансны хураамж -Тус ангилалд шилжсэн тохиолдолд (сар бүр), 200, 0.2, 20, 1, 20, -, -, 10, -, -"
https://www.xacbank.mn/product/6,Бүрдүүлэх материал,Харилцах,"Харилцагчийн анкет /Банкны маягттатах/.
Монгол улсын иргэн бол иргэний үнэмлэх..
Гадаадын иргэн бол:Гадаад паспорт – Харилцагчийн зураг, овог нэр, нас, төрсөн огноо оруулсан дугаартай байх.Түр оршин суух үнэмлэх..
Гадаад паспорт – Харилцагчийн зураг, овог нэр, нас, төрсөн огноо оруулсан дугаартай байх..
Түр оршин суух үнэмлэх.."
https://www.xacbank.mn/product/60,Хариуцан даатгал боломжит эрсдэлүүд,Жолоочийн хариуцлагын албан журмын даатгал,"Авто тээврийн хэрэгсэл жолоодогчийн буруугаас бусдад учруулах дараах эрсдэлүүд:
No link found. Check URL: https://www.xacbank.mn/product/60"
https://www.xacbank.mn/product/60,Шаардлагатай бичиг баримтын жагсаалт,Жолоочийн хариуцлагын албан журмын даатгал,"Өмчлөгч, эзэмшигчийн мэдээлэл - Иргэний үнэмлэх, Байгууллагын гэрчилгээ..
Тээврийн хэрэгслийн гэрчилгээ, бичиг баримт..
Тээврийн хэрэгслийн нэр, марк, серийн дугаар болон бусад шаардлагатай мэдээллүүд.."
https://www.xacbank.mn/product/60,Нөхөн төлбөрийн тохиолдолд бүрдүүлэх материалын жагсаалт,Жолоочийн хариуцлагын албан журмын даатгал,"Даатгуулагчийн өргөдөл /маягтын дагуу/..
Замын цагдаагийн байгууллагын ослын дүгнэлт, тодорхойлолт..
Эрх бүхий байгууллагын хохирлын үнэлгээний тайлан..
Даатгалын гэрээ, гэрээт баталгааны эх хувь..
Холбогдогч жолооч нарын иргэний үнэмлэх, жолооны үнэмлэх болон тээврийн хэрэгслүүдийн гэрчилгээний хуулбар..
Бусад шаардлагатай материал.."
https://www.xacbank.mn/product/61,Даатгуулахад тавигдах шаардлага,Иргэдийн гэнэтийн ослын даатгал,Монгол улсын иргэд болон гадаадын харъяат ба иргэний харьяалалгүй 18-аас дээш насны иргэд..
https://www.xacbank.mn/product/61,Даатгах боломжит эрсдэлүүд,Иргэдийн гэнэтийн ослын даатгал,"Бүх төрлийн гэнэтийн осол түүнээс учирч болох үр дагавар:
No link found. Check URL: https://www.xacbank.mn/product/61"
https://www.xacbank.mn/product/61,Шаардлагатай бичиг баримтын жагсаалт,Иргэдийн гэнэтийн ослын даатгал,"Даатгуулагчийн иргэний үнэмлэхний хуулбар, утасны дугаар, и-мэйл хаяг..
Даатгуулагчийн эрхэлдэг ажил, албан тушаалыг нотлох бичиг баримт..
Нөхөн төлбөрийн эрхтэй этгээдийн иргэний үнэмлэхний хуулбар, утасны дугаар, и-мэйл хаяг.."
https://www.xacbank.mn/product/61,Нөхөн төлбөрийн тохиолдолд бүрдүүлэх материалын жагсаалт,Иргэдийн гэнэтийн ослын даатгал,"Даатгуулагчийн өргөдөл..
Холбогдох эрх бүхий байгууллагын дүгнэлт. (Жишээ нь: Онцгой байдлын газрын дүгнэлт г.м)..
Хохирлын үнэлгээний тайлан..
Даатгалын гэрээ, гэрээт баталгааны эх хувь..
Бусад шаардлагатай материал.."
https://www.xacbank.mn/product/63,Онцлог:,Харилцах данс,"Данс нээх валютын төрөл - MNT, USD, EUR, JPY, CNY, CAD, AUD, RUB, KRW, GBP.."
https://www.xacbank.mn/product/63,Үндсэн үйлчилгээ:,Харилцах данс,"Гадаад болон дотоод шилжүүлэг, төлбөр хүлээн авах..
Төрөл бүрийн валют арилжаа.."
https://www.xacbank.mn/product/63,Нэмэлт үйлчилгээ:,Харилцах данс,"Ажиллагсдын цалин тавих..
Ажиллагсдын хуримтлалын данс нээлгэх..
Борлуулалтын орлогоо цүнхээр / банкаар хураалгах..
Захиалгат гүйлгээхийх /standing order/..
Эскроу данс нээлгэх..
Интернэт банкаар үйлчлүүлэх.."
https://www.xacbank.mn/product/63,Давуу тал:,Харилцах данс,"Дансны тогтмол үлдэгдэлээс хамааруулан зээлийн хүүгийн хөнгөлөлт эдлэх..
Хэлцэлтэй арилжаа хийх..
ХасБанкны данс хоорондын гүйлгээнд шимтгэлгүй..
Дансны мэдээллээ цахим хаягаар хүлээн авах..
24 цагийн турш дансаа онлайнаар удирдах.."
https://www.xacbank.mn/product/63,Бүтээгдэхүүний нөхцөл:,Харилцах данс,"Хүүгийн хувь хэмжээ*, 100,000,000 ₮ хүртэл, 0.00%, 0.00%, -, -, -, -, -, -, -, -, -
100,000,001 ₮ – 1,000,000,000 ₮, 0.80%, 0.80%
1,000,000,001 ₮-с дээш, 1.20%, 1.21%
Харилцах дансанд заавал байлгах үлдэгдлийн доод хэмжээ, 10,000, 10, 10, 250, 1,000, 50, 10, 10, 10, 20,000
Данс хөтөлсний шимтгэл (сар бүр), 1,000, 1, 1, 25, 80, 5, 1, 1, 1, 1,000
Данс нээхэд, Хураамжгүй
Данс хаах хураамж, 3,000₮"
https://www.xacbank.mn/product/63,"бусад шимтгэл, хураамж",Харилцах данс,"Орлогын гүйлгээ, Бэлэн бус орлого, Шимтгэлгүй
Бэлэн орлого, Шимтгэлгүй, 0.20%, Зөвхөн бэлэн бусаар хийнэ, 20%, 1.50%, 0.30%
Бэлэн бусаар шилжүүлэг хийх, Цахим суваг ашиглан хийх ХасБанкны данс хоорондын гүйлгээ, Шимтгэлгүй
Салбарт хийгдэх ХасБанкны данс хоорондын  гүйлгээ, Шимтгэлгүй
Банк  хоорондын гүйлгээ, 200₮1, 1, 0.5, 1000₮, -, -, -, -, -, -
Бэлэн зарлагын гүйлгээ2, Бэлнээр тушаасан орлогоос бэлнээр гаргахад, 200₮, 0-10,000 USD түүнтэй тэнцэх - 5,000 төгрөг10,000-100,000 USD түүнтэй тэнцэх - 10,000 төгрөг100,000 USD-с дээш түүнтэй тэнцэх - 20,000 төгрөг
Бэлэн бусаар шилжүүлсэн орлогоос бэлнээр гаргахад1, 200₮, 0.30%, 0.50%, 0.50%, 0.50%, Зөвхөн бэлэн бусаар гүйлгээ хийнэ., 2.00%, 2.00%, 0.50%
Бэлэн мөнгө тушааж, бусад банк уруу шилжүүлэг хийх, 2,000₮
Залруулга-ын гүйлгээ3, 500₮
Тодорхойлолт4, 5,000₮
Хуулга, Цахим шуудангаар илгээхэд, Шимтгэлгүй
Хэвлэж өгөхөд 1 хуудасны үнэ, 100₮
СВИФТ системээр илгээхэд5, 1 удаа, 2,000₮
1 сарын турш өдөр бүр, 30,000₮
Лавлагаа, 1 жилийн доторх баримтаас, 10,000₮
1 жилээс дээшхи хугацааны баримтаас, 20,000₮"
https://www.xacbank.mn/product/63,Бүрдүүлэх материал:,Харилцах данс,"Харилцагчийн анкет /Банкны маягттатах/..
Улсын бүртгэлийн гэрчилгээний нотариатаар баталгаажуулсан хуулбар..
Хуулийн этгээдийн дүрмийн хуулбар..
Гарын үсгийн баталгаа нотариатаар баталгаажуулах /Банкны маягттатах/..
Мөнгөн хөрөнгө захиран зарцуулах эрх бүхий этгээдийн цахим үнэмлэхний хуулбар..
Эцсийн өмчлөгч тодорхойлсон байгууллагын албан тоот.."
https://www.xacbank.mn/product/65,Хөрөнгийн зах зээлд оролцогч болж хөрөнгийн биржийн үнэт цаасны арилжаанд оролцох боломжийг бий болголоо.,Үнэт цаасны төлбөр тооцооны эскроу данс,"ХасБанк брокерийн компаниар зуучлуулан үнэт цаасанд хөрөнгө оруулагч иргэн, байгууллагуудад зөвхөн үнэт цаасны төлбөр тооцоогоо гүйцэтгэхэд зориулсан ТУСГАЙ НӨХЦӨЛТЭЙ ЭСКРОУ ДАНС-ыг санал болгож байна. Хэрэв таны үйлчлүүлэгч брокер дилерийн компани /БДК/ ХасБанктай хамтран ажиллах гэрээтэй бол та эскроу данс эзэмших боломжтой ба дансаараа дамжуулан:
No link found. Check URL: https://www.xacbank.mn/product/65"
https://www.xacbank.mn/product/65,Давуу тал:,Үнэт цаасны төлбөр тооцооны эскроу данс,"Дансаа зайнаас удирдана:Та интернет банк, мобайл банкны үйлчилгээгээр дамжуулан дансандаа орлогын гүйлгээ хийх, дансаа зайнаас удирдах, хянах боломжтой..
Мөнгөн хөрөнгөө бүрэн хянана:Таны үнэт цаасны арилжааны төлбөр тооцоо зөвхөн уг дансаар гүйцэтгэгдэх ба мөнгөн хөрөнгөө зайнаас бүрэн хянах боломжтой..
Таны цагийг хэмнэнэ:Та өөрт ойр байрлах ХасБанкны салбар, нэгжээр дамжуулан эсхүл цахим болон мобайл үйлчилгээг ашиглан данс хянах, удирдах боломжтой.."
https://www.xacbank.mn/product/65,"Хураамж, шимтгэлийн нөхцөл:",Үнэт цаасны төлбөр тооцооны эскроу данс,"Данс нээх валют, Төгрөг, Төгрөг
Сарын үйлчилгээний хураамж/төгрөг, 4,000*, 6,000
Данс нээх доод үлдэгдэл, -, -"
https://www.xacbank.mn/product/65,Бүрдүүлэх материал:,Үнэт цаасны төлбөр тооцооны эскроу данс,"Эскроу данс нээлгэх хүсэлт /Банкны маягт/..
Зуучлалын гэрээний хуулбар /БДК-тай байгуулсан гэрээ/..
ААН-үүдийн хувьд улсын бүртгэлийн гэрчилгээний нотариатаар баталгаажуулсан хуулбар. /Шинээр үүсгэн байгуулагдаж байгаа бол байгууллагын “нэрийн баталгаажуулалтын хуудас”..
Гарын үсгийн баталгаа нотариатаар баталгаажуулах /Банкны маягт татах/..
Мөнгөн хөрөнгө захиран зарцуулах эрх бүхий этгээдийн цахим үнэмлэхний хуулбар.."
https://www.xacbank.mn/product/66,Онцлог:,Хөрөнгө шилжүүлэх ажил гүйцэтгэх эскроу данс,"Эскроу дансыг энгийн нөхцлөөр нээлгэсэн үед зөвхөн харилцагч талуудын хамтран гаргасан хүсэлтийг үндэслэн банк төлбөрийг шилжүүлдэг..
Тусгай нөхцлөөр нээлгэсэн үед талуудын аль нэгний гаргасан төлбөр гүйцэтгэх хүсэлтийг үндэслэн банк тодорхой ажиллагаа хийснээр төлбөрийг шилжүүлдэг.."
https://www.xacbank.mn/product/66,Давуу тал:,Хөрөнгө шилжүүлэх ажил гүйцэтгэх эскроу данс,"Танд учирч болох эрсдлийг бууруулах, арилгах..
Талуудын хооронд үл ойлголцол, эргэлзэл үүсэхгүй байх.."
https://www.xacbank.mn/product/66,"Хураамж, шимтгэлийн нөхцөл:",Хөрөнгө шилжүүлэх ажил гүйцэтгэх эскроу данс,"Худалдан авагч тал/ худалдагч тал, 0.3%/дээд хэмжээ 200,000 төгрөг//ам.доллар, евро бол 200/"
https://www.xacbank.mn/product/66,Бүрдүүлэх материал:,Хөрөнгө шилжүүлэх ажил гүйцэтгэх эскроу данс,"Эскроу данс нээлгэх хүсэлт /Банкны маягт татах/..
Талуудын хооронд байгуулсан гэрээний хуулбар, эх хувийн хамт..
Улсын бүртгэлийн гэрчилгээний нотариатаар баталгаажуулсан хуулбар. /Шинээр үүсгэн байгуулагдаж байгаа бол байгууллагын “нэрийн баталгаажуулалтын хуудас""..
Хуулийн этгээдийн дүрмийн хуулбар..
Гарын үсгийн баталгаа нотариатаар баталгаажуулах /Банкны маягт татах/..
Мөнгөн хөрөнгө захиран зарцуулах эрх бүхий этгээдийн цахим үнэмлэхний хуулбар.."
https://www.xacbank.mn/product/67,Нөхцөл:,Хуримтлалын нэрийн данс,"Хүү /жилийн, энгийн аргаар бодно/, 11.0%, -
Хугацаа, 60 сар ба түүнээс дээш"
https://www.xacbank.mn/product/67,Давуу тал:,Хуримтлалын нэрийн данс,"Хуримтлалыг зөвхөн та бүрдүүлэх бус байгууллага тань таньд туслан хамтдаа бүрдүүлнэ..
Өндөр хүүгийн өгөөж..
Өнөөдрийн хуримтлал нь Ирээдүйн баталгааг бий болгоно.."
https://www.xacbank.mn/product/67,Хэрхэн хамрагдах вэ?,Хуримтлалын нэрийн данс,"Байгууллага болон Ажилтнаас шилжүүлэх мөнгөн дүнгийн хувь, хэмжээ, давтамж..
Дансны хугацаа..
Данснаас зарлага гаргах нөхцөл.."
