url,question,context,answer
https://www.xacbank.mn/product/14,амины орон сууцтай болох гэж байгаа бол,Амины орон сууцны зээл,"Амины сууц худалдан авах зээлХарилцагч та өмчлөлийн газар дээр, архитектурын зураг төслийн дагуу баригдсан, инженерийн шугам сүлжээнд холбогдсон эсхүл бие даасан цэвэр бохир ус, халаалтын систем бүхий хувийн байшин худалдан авахаар төлөвлөж байгаа бол “Амины сууц худалдан авах"" зээлийг сонгоорой..
Амины сууц барих зээлХарилцагч та өмчлөлийн газар дээр, архитектурын зураг төслийн дагуу, нийтийн инженерийн шугам сүлжээнд холбогдсон эсхүл бие даасан цэвэр бохир ус, халаалтын систем бүхий хувийн байшин барихаар төлөвлөж байгаа бол “Амины сууц барьж дуусгах"" зээлд хамрагдаарай. Таны барилгын ажлын явц 50 хувь буюу таазны хучилт, шал хийгдсэн байх шаардлагатай.."
https://www.xacbank.mn/product/14,Бүтээгдэхүүнийн нөхцөл,Амины орон сууцны зээл,"Дээд хэмжээ, Улаанбаатар хот, 200 сая төгрөг, 200 сая төгрөг
Орон нутаг, 100 сая төгрөг, 100 сая төгрөг
Урьдчилгаа төлбөр, 30%, Барилгын ажлын гүйцэтгэл: зээлийн хэмжээ 40 сая төгрөгөөс доош бол-20 хувь, зээлийн хэмжээ 40 сая төгрөгөөс дээш бол-50 хувь буюу *Газар, шороо, өндөржилт, шугаман суурь цутгалт хийсэн байх
Хүү, Сарын, ₮: 1.5%
Жилийн, ₮: 18.0%
Хугацаа, 180 сар
Үйлчилгээний шимтгэл, Урьдчилгаа 25%-40%: 1.0%Урьдчилгаа 40%-50%: 0.5%Урьдчилгаа 50%-аас дээш: 0.0%"
https://www.xacbank.mn/product/14,Бүрдүүлэх материал:,Амины орон сууцны зээл,"Зээлийн өргөдөл /маягтаар/..
Зээл хүсэгч болон түүний гэр бүлийн гишүүдийн иргэний үнэмлэх, нотариатаар баталгаажсан хуулбарын хамт..
Зээл хүсэгчийн сүүлийн 12 сарын дотор авахуулсан 3х4 хэмжээтэй 2 хувь цээж зураг..
Зээл хүсэгч болон түүний гэр бүлийн гишүүдийн боловсрол, мэргэжил, хөдөлмөр эрхлэлтийн байдал, эрхэлж байсан бизнесийн талаарх товч танилцуулга..
Худалдан авах амины орон сууц болон байшинг барих газрын өмчлөх эрхийн улсын бүртгэлийн гэрчилгээний нотариатаар баталгаажуулсан хуулбар, зээлийн хүсэлт гаргахаас 7-ooс дээшгүй хоногийн өмнө Эрхийн Улсын Бүртгэлийн Албанаас авсан Эд хөрөнгө өмчлөх эрх, түүнтэй холбоотой эд хөрөнгийн бусад эрхийн улсын бүртгэлийн лавлагаа..
Банкны зүгээс шаардлагатай гэж үзсэн бусад нэмэлт материал.."
https://www.xacbank.mn/product/14,Амины орон сууц худалдан авах бол,Амины орон сууцны зээл,"Урьдчилгаа төлбөрийг төлсөн, эсхүл төлөх боломжтойг нотлох баримт /төлбөр төлсөн баримт, хадгаламжийн гэрээ, дэвтэр гэх мэт/..
Зээл хүсэгч болон худалдагч тал үл хөдлөх эд хөрөнгө худалдах, худалдан авах гэрээ байгуулсан бол түүний эх хувь..
Амины орон сууцны газрын кадастрын зураг..
Үл хөдлөх хөрөнгийн өмчлөлийн гэрчилгээний хуулбар..
Амь нас, эд хөрөнгийн даатгалын гэрээ.."
https://www.xacbank.mn/product/14,Амины орон сууц барьж дуусгах бол,Амины орон сууцны зээл,"Газрын өмчлөх эрхийн гэрчилгээ, барилга барих газар олгосон тухай аймаг, нийслэлийн засаг даргын захирамж, газар эзэмших гэрээ..
Техникийн нөхцөл бүрдүүлсэн баримт бичиг..
Барилгын хянагдсан зураг төсөв..
Барилгын ажлын ерөнхий төлөвлөгөө..
Барилгын материал, тоног төхөөрөмж худалдан авах, түрээслэх, амины орон сууц барих, халаалт болон ус хангамжийн систем суурилуулах ажлуудын гүйцэтгэгчтэй байгуулсан болон холбогдох бусад гэрээ, хэлцэлүүд, санхүүжилтийн төлөвлөгөөний хамт, гүйцэтгэлийн акт.."
https://www.xacbank.mn/product/15,Орон сууцанд тавигдах шаардлага:,6 хувийн хүүтэй зээл,"Худалдан авч буй орон сууц нь ашиглалтад орсон буюу улсын комисс хүлээн авсан байх..
Нийтийн зориулалттай орон сууц нь 80 м.кв-аас ихгүй талбайтай байх бөгөөд амьдран суух зориулалтаар ашиглах..
Үл хөдлөх хөрөнгийн өмчлөх эрхийн гэрчилгээтэй байх..
Орон сууцны өмчлөх эрхийг гуравдагч этгээдэд шаардах эрх үүсээгүй байх.."
https://www.xacbank.mn/product/15,Зээл хүсэгчид тавигдах шаардлага:,6 хувийн хүүтэй зээл,"Монгол Улсын иргэн, 18 нас хүрсэн, эрх зүйн бүрэн чадамжтай..
Банк, санхүүгийн байгууллагад хугацаа хэтэрсэн, чанаргүй зээлийн өр болон шүүхийн шийдвэрийн дагуу төлөх өр төлбөргүй байх..
Үндсэн зээлдэгч нь төрөөс хэрэгжүүлж буй орон сууцны ипотекийн хөнгөлөлттэй хүүтэй зээл болон түрээслээд өмчлөх орон сууцны хөтөлбөрт хамрагдаагүй байх..
Урьдчилгаа төлбөрийг санхүүжүүлсэн эсвэл санхүүжүүлэх чадвартай байх..
Өр төлбөр, татварын өмнөх орлогын харьцаа 45 хувь (идэвхтэй зээлийн сарын төлбөрүүд орно)..
Бизнес болон цалингийн тогтмол орлоготой байх..
Ажил болон бизнесийн үйл ажиллагааг сүүлийн 1 жил тогтвортой эрхэлж буй..
Зээлийн гэрээний хугацаа дуусгавар болох үед 65-аас дээшгүй настай байх..
Амь нас, эд хөрөнгийн даатгал хийгдсэн байх.."
https://www.xacbank.mn/product/15,Зээл шилжүүлэх:,6 хувийн хүүтэй зээл,"Та ХасБанкны зээл авсан салбар, тооцооны төвд хандан зээл шилжүүлэх хүсэлтээ одоогийн орлогын хэмжээг тодорхойлох баримтуудын хамт ирүүлнэ үү.
No link found. Check URL: https://www.xacbank.mn/product/15"
https://www.xacbank.mn/product/15,Бүтээгдэхүүнийн нөхцөл:,6 хувийн хүүтэй зээл,"30 жил хүртэл, 6%, 30%, 1%"
https://www.xacbank.mn/product/15,Бүрдүүлэх материал:,6 хувийн хүүтэй зээл,"Зээл шилжүүлэхэд шаардлагатай бичиг баримтын жагсаалт:
No link found. Check URL: https://www.xacbank.mn/product/15"
https://www.xacbank.mn/product/24,Давуу тал,Эргэлтийн хөрөнгийн зээл,"Таны бизнесийн цар хүрээ, хөрөнгө санхүүгийн чадвараас хамаарч зээлийн хэмжээг тогтооно..
Зээлийн сайн түүхтэй, ХасБанканд харилцах, хадгаламжийн данстай харилцагчид хүүг бууруулан тогтооно..
Таны бизнесийн онцлог, улирлын шинж чанарт тохируулан зээлийн эргэн төлөлтийн уян хатан нөхцөл санал болгож, зээлийн үндсэн төлбөрөөс 8 хүртэл сараар чөлөөлнө..
Эргэлтийн хөрөнгөө барьцаалан зээл авах боломжтой..
Та зээлтэй хэдий ч дахин зээл олгож, нэмэлт хэрэгцээг санхүүжүүлнэ..
Эргэлтийн хөрөнгийн зээлийг зээлийн шугам байдлаар авах боломжтой.."
https://www.xacbank.mn/product/24,Зээлийн зориулалт,Эргэлтийн хөрөнгийн зээл,"Та шинээр бизнес эрхлэх гэж буй болон эргэлтийн хөрөнгөө нэмэгдүүлэх, бизнесээ өргөжүүлж ашиг орлогоо өсгөхөөр зорьж байгаа бол “эргэлтийн хөрөнгийн санхүүжилт”-ийн зээл танд туслана..
Та бизнесийн орлоготой ч гэртээ тавилга, цахилгаан бараа авах, хашаа байшин, орон сууцаа засварлах, хүүхдийнхээ сургалтын төлбөрийг төлөх, аялаж зугаалах зорилгоор өрхийн хэрэглээндээ зориулж зээл авч болно.."
https://www.xacbank.mn/product/24,Бүтээгдэхүүний нөхцөл,Эргэлтийн хөрөнгийн зээл,"0-500 сая төгрөг хүртэл, 36 сар, 1.8%-2.0%, 21.6% - 24.0%, Банкнаас авсан зээлийн тоо болон банканд байршуулсан эх үүсвэрийн багцаас хамаарч зээлийн хүүг бууруулна., 5 хүртэл сая төгрөгийн зээл -0.5 %5 саяас дээш төгрөгийн зээл - 1%Зээлийн шугамын үүрэг хүлээсний шимтгэл 500 сая төгрөгийн зээл хүртэл - 0.2%Зээлийн шугамын үүрэг хүлээсний шимтгэл 500 саяас дээш төгрөгийн зээл - 0.25%
500 саяас 2.5 тэрбум төгрөг хүртэл, 1.6%-2.0%, 19.2% - 24.0%"
https://www.xacbank.mn/product/24,Тавигдах шаардлага,Эргэлтийн хөрөнгийн зээл,"Зээлээ эргэн төлөхүйц бизнесийн орлоготой, баталгаажсан байх,.
Тухайн бизнесээ 6 сараас дээш хугацаанд эрхэлсэн байх,.
Хөдлөх болон үл хөдлөх хөрөнгийн барьцаатай байх.."
https://www.xacbank.mn/product/24,Бүрдүүлэх материал,Эргэлтийн хөрөнгийн зээл,"ИРГЭН:
No link found. Check URL: https://www.xacbank.mn/product/24"
https://www.xacbank.mn/product/25,Давуу тал,Үндсэн хөрөнгийн зээл,"Таны бизнесийн цар хүрээ, хөрөнгө санхүүгийн чадвараас хамаарч зээлийн хэмжээг тогтооно..
Зээлийн сайн түүхтэй, ХасБанканд харилцах, хадгаламжийн данстай харилцагчид хүүг бууруулан тогтооно..
Таны бизнесийн онцлог, улирлын шинж чанарт тохируулан зээлийн эргэн төлөлтийн уян хатан нөхцөл санал болгож, зээлийн үндсэн төлбөрөөс 24 хүртэл сараар чөлөөлнө..
Эргэлтийн хөрөнгөө барьцаалан зээл авах боломжтой..
Та зээлтэй хэдий ч дахин зээл олгож нэмэлт хэрэгцээг санхүүжүүлнэ.."
https://www.xacbank.mn/product/25,Зээлийн зориулалт,Үндсэн хөрөнгийн зээл,"Танд бизнесээ явуулах ажлын байр болон бизнесийн зориулалттай тоног төхөөрөмж худалдан авах хэрэгцээ байгаа бол “Үндсэн хөрөнгө, тоног төхөөрөмжийн санхүүжилт”-ийн зээл танд тусална.."
https://www.xacbank.mn/product/25,Бүтээгдэхүүнийн нөхцөл,Үндсэн хөрөнгийн зээл,"Төрөл, Жижиг бизнесийн зээл, Дунд бизнесийн зээл
Хэмжээ, 500.0 сая төгрөг хүртэл, 500.0 сая – 2.5 тэрбум төгрөг хүртэл
Хугацаа, 60 хүртэл сар
Хүү*, Сарын, ₮: 1.8% - 2.0%$: 1.10% - 1.50%, ₮: 1.6% - 2.0%$: 1.10% - 1.50%
Жилийн, ₮: 21.6% - 24.0%$: 13.2% - 18.0%, ₮: 19.2% - 24.0%$: 13.2% - 18.0%
Хүү буурах нөхцөл, Банкнаас авсан зээлийн тоо болон банкинд байршуулсан эх үүсвэрийн багцаас хамаарч зээлийн хүүг бууруулна.
Үйлчилгээний шимтгэл, Төгрөг: 1%Ам.доллар: 0.5%
Зээлийн батлан даалтын сангийн талаар дэлгэрэнгүй мэдээлэл авах бол:, Утас: 70110057, 70110058Вэб:www.lgf.mn"
https://www.xacbank.mn/product/25,Тавигдах шаардлага,Үндсэн хөрөнгийн зээл,"Зээлээ эргэн төлөхүйц бизнесийн орлоготой, баталгаажсан байх..
Тухайн бизнесээ 6 сараас дээш хугацаанд эрхэлсэн байх..
Хөдлөх болон үл хөдлөх хөрөнгийн барьцаатай байх.."
https://www.xacbank.mn/product/25,Бүрдүүлэх материал:,Үндсэн хөрөнгийн зээл,"ИРГЭН:
No link found. Check URL: https://www.xacbank.mn/product/25"
https://www.xacbank.mn/product/26,Давуу тал,Хүүгээ зарлагаддаг хугацаатай хадгаламж,"Сар бүр хүүгийн орлогоо хүлээн авах..
Хадгаламжийн дансаа барьцаалан зээл авч богино хугацааны санхүүгийн хэрэгцээгээ шийдвэрлэх..
Цахим банкны үйлчилгээнд бүртгүүлэн, банкинд ирэхгүйгээр интернет, гар утас ашиглан дансны үлдэгдлээ шалгах..
Дансандаа орлого хийх боломжтой.."
https://www.xacbank.mn/product/26,Бүтээгдэхүүний нөхцөл,Хүүгээ зарлагаддаг хугацаатай хадгаламж,"Төгрөг, 1,000,000, 9.6%, 10.2%, 11.0%, 11.0%, 12.0%, 2.40%
Ам.доллар, 1,000, 1.40%, 1.60%, 1.80%, -, -, Тухайн валютын хугацаагүй хадгаламжийн жилийн хүүний хувь хэмжээний 50 хувиар тооцно.
Данс нээхэд, Хураамжгүй
Хадгаламжийн дэвтэр, Үнэгүй
Гэрээний хугацаанаас өмнө гэрээ цуцлах хураамж, 3,000₮"
https://www.xacbank.mn/product/26,"Бусад шимтгэл, хураамж",Хүүгээ зарлагаддаг хугацаатай хадгаламж,"Орлогын гүйлгээ, Бэлэн бус орлого, Шимтгэлгүй
Бэлэн орлого, Шимтгэлгүй
Тодорхойлолт*, 5,000₮
Хуулга, Цахим шуудангаар илгээхэд, Шимтгэлгүй
Хэвлэж өгөхөд 1 хуудасны үнэ, 100₮
Лавлагаа, 1 жилийн доторх баримтаас, 10,000₮
1 жилээс дээшхи хугацааны баримтаас, 20,000"
https://www.xacbank.mn/product/26,Бүрдүүлэх материал,Хүүгээ зарлагаддаг хугацаатай хадгаламж,"Монгол улсын иргэн бол иргэний үнэмлэх..
Гадаадын иргэн бол:Гадаад паспорт – Харилцагчийн зураг, овог нэр, нас, төрсөн огноо оруулсан дугаартай байх.Түр оршин суух үнэмлэх..
Гадаад паспорт – Харилцагчийн зураг, овог нэр, нас, төрсөн огноо оруулсан дугаартай байх..
Түр оршин суух үнэмлэх.."
https://www.xacbank.mn/product/36,Давуу тал,Ирээдүйн саятан /Хүүхдийн хадгаламж/,"Хүүг нийлмэл аргаар буюу хүүнээс хүү боддог..
Хүүхдийн мөнгийг сар бүр хадгаламжийн дансандаа хүлээн авах..
Хадгаламжаа барьцаалан зээл авч богино хугацааны санхүүгийн хэрэгцээгээ шийдвэрлэх боломжтой..
Цахим банкны үйлчилгээнд бүртгүүлэн, банканд ирэхгүйгээр интернет, гар утас ашиглан хүүхдийнхээ дансны үлдэгдлийг шалгах, гүйлгээ хийж, өөрийн дансаа удирдах боломжтой..
Цахим банкаар өөрийн хүүхдэдээ хадгаламж нээх болон бусдын хүүхдэд хадгаламж нээн бэлэглэх боломжтой.."
https://www.xacbank.mn/product/36,Бүтээгдэхүүнийн нөхцөл,Ирээдүйн саятан /Хүүхдийн хадгаламж/,"Төгрөг, 20,000 төгрөг, Хүүхдийн 18 насны төрсөн өдөр хүртэл, 11.0%, 11.57%, 2.40%
Данс нээхэд, Хураамжгүй
Гэрээний хугацаанаас өмнө гэрээ цуцлах хураамж, 3,000₮"
https://www.xacbank.mn/product/36,"бусад шимтгэл, хураамж",Ирээдүйн саятан /Хүүхдийн хадгаламж/,"Орлогын гүйлгээ, Бэлэн бус орлого, Шимтгэлгүй
Бэлэн орлого, Шимтгэлгүй
Тодорхойлолт *, 5,000₮
Хуулга, Цахим шуудангаар илгээхэд, Шимтгэлгүй
Хэвлэж өгөхөд 1 хуудасны үнэ, 100₮
Лавлагаа, 1 жилийн доторх баримтаас, 10,000₮
1 жилээс дээшхи хугацааны баримтаас, 20,000₮"
https://www.xacbank.mn/product/36,Бүрдүүлэх материал,Ирээдүйн саятан /Хүүхдийн хадгаламж/,Хүүхдийн төрсний гэрчилгээ болон эцэг эхийн аль нэгнийх нь иргэний үнэмлэх..
https://www.xacbank.mn/product/4,Давуу тал,Өрхийн зээл,"Зээлийн хүсэлтийг хурдан шуурхай шийдвэрлэн олгодог..
Зээлийн хугацаанд дахин санхүүжилт хийн зээлийн хэмжээг нэмэгдүүлэн авах боломжтой..
Зээлийг урьдчилан төлөхөд торгуульгүй..
Зардал их гаргадаг баяр ёслол, амралтын үедээ нэг сарын зээлийн үндсэн төлбөрөөс чөлөөлөгдөж, зөвхөн зээлийнхээ хүүг төлөх боломжтой.."
https://www.xacbank.mn/product/4,Бүтээгдэхүүнийн нөхцөл,Өрхийн зээл,"50 сая төгрөг хүртэл, 30 сар, 2.0%, 24.0%, 1%"
https://www.xacbank.mn/product/4,Тавигдах шаардлага,Өрхийн зээл,"Сүүлийн 6 сарын хугацаанд ажил, бизнес тогтвортой эрхэлсэн байх.
Зээлийн барьцаанд тавих хөдлөх болон үл хөдлөх хөрөнгөтэй байх..
Зээлийн муу түүхгүй байх.."
https://www.xacbank.mn/product/4,Бүрдүүлэх материал,Өрхийн зээл,"Хэрэглээний зээлийн өргөдөл (ХасБанкны салбараас эсхүлэнд даржтатаж авна уу)..
3х4 хэмжээний цээж зураг..
Зээл хүсэгч болон өрхийн гишүүдийн иргэний үнэмлэх, түүний хуулбар..
Зээл хүсэгч болон гэр бүлийн хөдөлмөр эрхэлдэг гишүүдийн НДДэвтэр, түүний хуулбар..
Зээл хүсэгч болон гэр бүлийн гишүүдийн НДДэвтэрт бодит цалин тусгагдаагүй бол цалингийн тодорхойлолт (ХасБанкны салбараас эсхүлэнд даржтатаж авна уу)..
Өрхийн гишүүд бизнесийн орлоготой бол бизнесийн орлогыг нотлох баримтууд..
Барьцаалуулах хөрөнгийн өмчлөлийн гэрчилгээ..
Банкны зүгээс шаардлагатай гэж үзсэн бусад нэмэлт материал.."
https://www.xacbank.mn/product/40,Давуу тал:,МИАТ кредит карт,"Дэлхийн хаана ч ашиглах боломжтой кредит карт..
Цуглуулсан “миль”-ээ ашиглан онгоцны тийз авах, “Чингис Хаан” онгоцны буудлын бизнес лоунжаар үйлчлүүлэх..
Сар бүр дэлгэрэнгүй төлбөрийн нэхэмжлэхээ интернэт банкаар харах..
ХасИнфо буюу мессежээр гүйлгээ мэдэгдэх үйлчилгээ үнэгүй авна..
Төлбөр төлөх өдөр нийт нэхэмжилсэн дүнг бүрэн төлбөл худалдан авалтын хүүгээс чөлөөлөгдөх боломжтой.."
https://www.xacbank.mn/product/40,"""Миль"" цуглуулах боломжууд:",МИАТ кредит карт,"10,000 төгрөгийн худалдан авалтын гүйлгээ тутам 1 миль..
Монгол улсад ХасБанкны карт уншигч төхөөрөмжид картаа уншуулаад “миль” цуглуулах..
Гадаадад аль ч банкы карт уншигч төхөөрөмжид картаа уншуулан “миль” цуглуулна.."
https://www.xacbank.mn/product/40,Бүтээгдэхүүнийн нөхцөл,МИАТ кредит карт,"Дансны валют, Төгрөг
Жилийн хураамж, 30,000 төг
Зээлийн эрхийн дээд хэмжээ, 25,000,000 төг
Зээлийн эрхийн доод хэмжээ, 1,500,000 төг
Худалдан авалтын гүйлгээний хүү, 2% /сарын/, 24% /жилийн/
Бэлэн мөнгөний гүйлгээний хүү /сар/, 2.8% /сарын/, 33.6% /жилийн/"
https://www.xacbank.mn/product/40,"""Миль"" ашиглан МИАТ-с худалдан авах боломжтой бүтээгдэхүүн, үйлчилгээ:",МИАТ кредит карт,"Бээжин, 7,500, 15,000, 10,000, 20,000, 6,000/12,000, 3,000
Сөүл, 12,500, 25,000, 15,500, 31,000, 10,000/20,000, 4,000
Хонгконг, 18,500, 37,000, 22,500, 45,000, 15,000/30,000, 5,500
Токио, 19,000, 38,000, 23,500, 47,000, 15,000/30,000, 4,500
Москва, 29,000, 58,000, 36,000, 72,000, 23,000/46,000, 5,500
Берлин, 38,500, 77,000, 48,000, 96,000, 31,000/62,000, 9,000
Франкфурт, 38,500, 77,000, 48,000, 96,000, 31,000/62,000, 9,000
Москва - Берлин, 10,000, 20,000, 15,000, 30,000, 8,000/16,000, 5,000
Пусан, 15,000, 30,000, 18,500, 37,000, 15,000/30,000, 4,500
Бангкок, 22,500, 45,000, 27,500, 55,000, 23,000/46,000, 6,000"
