url,question,context,answer
https://www.xacbank.mn/product/1147,БҮРДҮҮЛЭХ МАТЕРИАЛ:,Хасын Хүлэгүүд Виза карт,"Монгол Улсын иргэн бол - иргэний үнэмлэх эсхүл гадаад паспорт..
Гадаадын иргэн бол - түр оршин суух үнэмлэх.."
https://www.xacbank.mn/product/1147,КАРТ ЗАХИАЛАХ,Хасын Хүлэгүүд Виза карт,"FIFA World Cup тэмцээний албан ёсны Виза картыг та зөвхөн Дижитал банкаар захиалах боломжтой.
No link found. Check URL: https://www.xacbank.mn/product/1147"
https://www.xacbank.mn/product/1148,Бүтээгдэхүүний нөхцөл,CHIP багц төслийн зээл,"Зээлийн хэмжээ, 3,200,000 төгрөг/Энэ нь багц бүтээгдэхүүний үндсэн үнэ бөгөөд тодорхой шаардлага хангасан иргэдэд үндсэн үнийн дүнгээс 50-70% хөнгөлөлттэй*үнээр олгох боломжтой./
Зээлийн хүү, Жилийн 6%
Зээлийн хугацаа, 30 сар
Үйлчилгээний шимтгэл, 1%"
https://www.xacbank.mn/product/1148,Тавигдах шаардлага,CHIP багц төслийн зээл,"Зээлийн эргэн төлөлтийн хуваарийн дагуу төлөх боломжтой байх..
Шаардсан тохиолдолд хамтран үүрэг гүйцэтгэгчтэй байх..
Зээл хүсэгч болон хамтран үүрэг гүйцэтгэгч нь хугацаа хэтэрсэн зээлийн үлдэгдэлгүй байх..
Цалингийн орлоготой бол сүүлийн 6 сараас доошгүй хугацаанд тухайн байгууллагад ажилласан байх..
Бизнесийн орлоготой бол тухайн бизнесийг сүүлийн 6 сарын хугацаанд тогтвортой эрхэлсэн байх.."
https://www.xacbank.mn/product/1148,Бүрдүүлэх материал,CHIP багц төслийн зээл,"Зээлийн өргөдөл (ХасБанкны салбараас эсхүлэнд даржтатаж авна уу)..
Зээл хүсэгч болон хамтран үүрэг гүйцэтгэгчийн иргэний үнэмлэх, түүний хуулбар..
Цалингийн орлоготой бол нийгмийн даатгалын лавлагаа..
Бизнесийн орлоготой бол санхүүгийн баримт, бизнесийн орлого, үйл ажиллагааг тодорхойлох баримт, бусад баримт..
Бусад орлогыг тодорхойлох баримт..
CHIP багц бүтээгдэхүүний нийлүүлэгчээс авсан нэхэмжлэх..
Банкны зүгээс шаардлагатай гэж үзсэн бусад нэмэлт материалууд.."
https://www.xacbank.mn/product/1148,Нийлүүлэгч байгууллагууд,CHIP багц төслийн зээл,"""Өнө монгол гэр"" ХХК- 88117544""Оргил жим"" ХХК - 88110638""Их газрын чулуу"" ХХК - 88114839""Хасагтын содон хийц"" ХХК - 94676767""Мөнх тайж Алтай"" ХХК - 88040875, 86388888Саруул-Өргөө Констракшн - 99113648, ""Бунхан шанд"" ХХК - 89737317""Ихэр сайхан уул"" ХХК - 99944436, ""Буянт хөрс наран"" ХХК - 86121112""Хонгорын оргилд хүрэх зам"" ХХК - 88881256, ""Тансаг шүр"" ХХК - 99489829""Зайвар-Алтай"" ХХК - 99090308""Баян-Алтайн оргил"" ХХК - 99488447""Мастер куалити"" ХХК - 99299139""Дүүрэн жавхаа"" ХХК - 96588862""Соёмбо эмбройдер"" ХХК - 88040875, 95111944""Дэлгэрэх жимс"" ХХК - 98919999""Хуруу цахир"" ХХК - 88051297""Мөнх тайж Алтай"" ХХК - 88040875, 86388888""Жанстчандмана"" ХХК - 89919104"
https://www.xacbank.mn/product/1148,CHIP Зээлийн процесс,CHIP багц төслийн зээл,"Алхам 1: ХарилцагчХорооны халамжын ажилтанд хандаж бүртгүүлнэ. Бүртгэлийг дүүргийн холбогдох нэгж судланаАлхам 2: Дүүргийн төслийн зохицуулагчТөслийн хөнгөлтийн 5 шалгуурийг хангаж байгаа бол худалдан авагчид мэдэгдэж зээлээр авах бол нэхэмжлэх бичиж өгнө.Алхам 3: БанкЗээл гарах боломжтой эсэхийг судлаж батлагдсан тухай харилцагчид бичгээр мэдэгдэнэ.Алхам 4: ХарилцагчЗээл гарсан тухай албан бичгийг дүүргийн ажилтанд өгнө.Алхам 5: Дүүргийн төслийн зохицуулагчДүүргийн төслийн зохицуулагч нийлүүлэгчтэй холбож өгнө.Алхам 6: НийлүүлэгчЧИП багцыг угсарч, суурилуулж өгнө. Хүлээлцсэн актад харилцан гарын үсэг зурна.Алхам 7: ХарилцагчБүтээгдэхүүн хүлээлцсэн актыг Банкны ажилтанд хүргүүлнэ. Зээл олголт хийгдэж хүү тооцогдож эхэлнэ., Алхам 1: ХарилцагчНийлүүлэгчид хандан бүтээгдэхүүнээ сонгоно.Алхам 2: НийлүүлэгчИргэн зээлээр авах бол нэхэмжлэх бичиж өгнө.Алхам 3: БанкХарилцагчид зээл гарах боломжтой эсэхийг судалж зээлийн шийдвэрийг бичгээр гаргаж өгнө.Алхам 4: НийлүүлэгчЧИП багцыг угсарч, суурилуулж өгнө. Хүлээлцсэн актад харилцан гарын үсэг зурна.Алхам 5: ХарилцагчБүтээгдэхүүн хүлээлцсэн актыг Банкны ажилтанд хүргүүлнэ. Зээл олголт хийгдэж хүү тооцогдож эхэлнэ."
https://www.xacbank.mn/product/1149,Давуу тал,Цалингийн хадгаламж,"Илүү өгөөж:Хүүгийн орлогын 10%-тай тэнцэх урамшуулал 12 сар тутамдаа олгоно..
Илүү боломж:Жилд нэг удаа хадгаламжийнхаа 20% хүртэл дүнгээр зарлага гаргах боломжтой..
Илүү хугацаа:5, 10, 15 жилийн хугацаанд тогтвортой өснө.
Хүүг нийлмэл аргаар буюу хүүгээс хүү бодно..
Хадгаламжийн дүн өсөх тусам танд очих өгөөж нэмэгдэнэ..
Хадгаламжаа барьцаалан зээл авч санхүүгийн гэнэтийн хэрэгцээгээ шийдвэрлэх..
Дижитал банкаар дамжуулан хурууны үзүүрээр дансаа удирдах боломжтой.."
https://www.xacbank.mn/product/1149,Бүтээгдэхүүний нөхцөл,Цалингийн хадгаламж,"Төгрөг, 20,000, 5 жил, Зарласан, 12.00%, 2.40%
Бодит*, 12.68%
Данс нээхэд, Хураамжгүй
Гэрээний хугацаанаас өмнө гэрээ цуцлах хураамж, 3,000₮"
https://www.xacbank.mn/product/1149,Хадгаламж нээх,Цалингийн хадгаламж,"Уг хадгаламжийг та банканд ирэлгүйгээр дижитал банкаар нээх боломжтой.
No link found. Check URL: https://www.xacbank.mn/product/1149"
https://www.xacbank.mn/product/1149,Бүрдүүлэх материал,Цалингийн хадгаламж,"Монгол улсын иргэн бол иргэний үнэмлэх..
Гадаадын иргэн бол:Гадаад паспорт – Харилцагчийн зураг, овог нэр, нас, төрсөн огноо оруулсан дугаартай байх.Түр оршин суух үнэмлэх..
Гадаад паспорт – Харилцагчийн зураг, овог нэр, нас, төрсөн огноо оруулсан дугаартай байх..
Түр оршин суух үнэмлэх.."
https://www.xacbank.mn/product/1150,Давуу тал,Мерчантын онлайн зээл,"Таны дансны ашиглалтаас хамаарч зээлийн хэмжээг тэр дор нь тогтооно..
Өмнө нь зээлтэй байсан ч нэг удаа дахин нэмэлтээр зээл авах боломжтой..
Зээлийн хугацааг нэг удаа сунгах боломжтой.."
https://www.xacbank.mn/product/1150,Зээлийн зориулалт,Мерчантын онлайн зээл,"Бизнесийн богино хугацааны эргэлтийн хөрөнгийг санхүүжүүлэх..
Та бизнесийн орлоготой ч өрхийн болон хувийн хэрэгцээндээ зориулж авч болно.."
https://www.xacbank.mn/product/1150,Бүтээгдэхүүний нөхцөл,Мерчантын онлайн зээл,"300,000 – 15,000,000 төгрөг хүртэл, 6 сар, 1.9%, 22.8%, Шинээр авах - зээлийн дүнгийн 1%Нэмж авах - нэмж авч буй дүнгийн 1%Хугацаа сунгах - тухайн үлдэгдэл дүнгийн 1%"
https://www.xacbank.mn/product/1150,Тавигдах шаардлага,Мерчантын онлайн зээл,"ХасБанкны ПОС-ыг 6 сараас доошгүй хугацаанд ашигласан байх..
ХасБанктай мастер гэрээ байгуулсан байх..
Сүүлийн 3 сарын орлогын дундаж 3 сая төгрөгөөс дээш байх..
Зээлийн сайн түүхтэй байх.."
https://www.xacbank.mn/product/1151,Давуу тал,Эмэгтэй бизнес эрхлэгчдийг дэмжих зээл,"Эмэгтэй бизнес эрхлэгчдэд илүү хөнгөлөлттэй хүүг санал болгоно..
50 сая төгрөг хүртэл барьцаагүй..
Ажлын 1-2 өдөрт шийдвэрлэнэ..
Таны бизнесийн онцлог, улирлын шинж чанарт тохируулан зээлийн эргэн төлөлтийн уян хатан нөхцөл санал болгож, зээлийн үндсэн төлбөрөөс 8 хүртэл сараар чөлөөлнө..
Эргэлтийн хөрөнгөө барьцаалан зээл авах боломжтой..
Та зээлтэй хэдий ч дахин зээл олгож, нэмэлт хэрэгцээг санхүүжүүлнэ..
Эргэлтийн хөрөнгийн зээлийг зээлийн шугам байдлаар авах боломжтой.."
https://www.xacbank.mn/product/1151,тавигдах шаардлага,Эмэгтэй бизнес эрхлэгчдийг дэмжих зээл,"✔ Эмэгтэй бизнес эрхлэгч иргэн байх;
No link found. Check URL: https://www.xacbank.mn/product/1151"
https://www.xacbank.mn/product/1151,Бүтээгдэхүүний нөхцөл,Эмэгтэй бизнес эрхлэгчдийг дэмжих зээл,"ЗЭЭЛИЙН ХЭМЖЭЭ, 100 сая төгрөг хүртэл, 100 - 500 сая төгрөг
ЗЭЭЛИЙН ХУГАЦАА, Эргэлтийн хөрөнгийн зориулалтаар: 36 сарҮндсэн хөрөнгийн зориулалтаар: 60 сар
ЗЭЭЛИЙН ХҮҮ, 1.7%/жилийн 20.4%/, 1.6% /жилийн 19.2%/
БАРЬЦАА, 50.0 сая төгрөг хүртэл барьцаагүй50.1-100.0 сая төгрөг хүртэл зөрүү дүнд хөдлөх болон үл хөдлөх хөрөнгө барьцаалах боломжтой, Зээлийн дүнгийн 50%-д үл хөдлөх хөрөнгө барьцаалах
ҮЙЛЧИЛГЭЭНИЙ ШИМТГЭЛ, 1%"
https://www.xacbank.mn/product/1151,Бүрдүүлэх материал,Эмэгтэй бизнес эрхлэгчдийг дэмжих зээл,"ИРГЭН:
No link found. Check URL: https://www.xacbank.mn/product/1151"
https://www.xacbank.mn/product/1152,Давуу тал,"Хүнс, хөдөө аж ахуйн үйлдвэрлэлийг дэмжих эргэлтийн хөрөнгийн зээл","Хаврын тариалалт, намрын ургац хураалтыг төлөвлөсөн хэмжээнд зохион байгуулах, хүнсний боловсруулах үйлдвэрийн хүчин чадал ашиглалт, үйлдвэрлэл, хангамж нэмэгдсэнээр хүнсний түүхий эд, бүтээгдэхүүний чанар, аюулгүй байдал сайжирна..
Үндсэн төлбөрөөс чөлөөлөх хугацаа 6 сар хүртэл.."
https://www.xacbank.mn/product/1152,Зээлийн зориулалт,"Хүнс, хөдөө аж ахуйн үйлдвэрлэлийг дэмжих эргэлтийн хөрөнгийн зээл","Хүнс, газар тариалан, мал аж ахуйн үйлдвэрлэлийн  чиглэлээр үйл ажиллагаа эрхэлдэг иргэн, аж ахуйн нэгж, хоршооны бизнесийн үйл ажиллагаагаа тогтвортой явуулахад шаардлагатай эргэлтийн хөрөнгийн зээл шинээр олгох, дахин санхүүжүүлэх.
No link found. Check URL: https://www.xacbank.mn/product/1152"
https://www.xacbank.mn/product/1152,Бүтээгдэхүүний нөхцөл,"Хүнс, хөдөө аж ахуйн үйлдвэрлэлийг дэмжих эргэлтийн хөрөнгийн зээл","5 тэрбум төгрөг хүртэл, 36 сар хүртэл, 0.42%, 5.0%, 1%"
https://www.xacbank.mn/product/1152,Тавигдах шаардлага,"Хүнс, хөдөө аж ахуйн үйлдвэрлэлийг дэмжих эргэлтийн хөрөнгийн зээл","Дараах үйл ажиллагааны чиглэлийн аль нэгт хамаарах бизнес эрхэлдэг байх. Үүнд:Газар тариалангийн үйлдвэрлэл:https://plant.mofa.gov.mn/цахим системд баталгаажсан байх. Өмчлөх, эзэмших эрхтэй болон түрээсийн газартай, үр тариа, тос, тэжээл, төмс хүнсний ногоо, мөөг, жимс, жимсгэнийн үйлдвэрлэл эрхлэгч.Хүнсний болон сав, баглаа боодолын үйлдвэрлэлийн чиглэлээр үйл ажиллагаа явуулдаг байх.Хүнсний боловсруулах үйлдвэр бүхий аж ахуйн нэгж, Гурил үйлдвэрлэгч аж ахуй эрхлэгчСүү, махны чиглэлийн эрчимжсэн аж ахуй, гахай, тахиа, зөгийн аж ахуй эрхлэгч, тэжээлийн үйлдвэрлэл эрхлэгч..
Газар тариалангийн үйлдвэрлэл:https://plant.mofa.gov.mn/цахим системд баталгаажсан байх. Өмчлөх, эзэмших эрхтэй болон түрээсийн газартай, үр тариа, тос, тэжээл, төмс хүнсний ногоо, мөөг, жимс, жимсгэнийн үйлдвэрлэл эрхлэгч..
Хүнсний болон сав, баглаа боодолын үйлдвэрлэлийн чиглэлээр үйл ажиллагаа явуулдаг байх.Хүнсний боловсруулах үйлдвэр бүхий аж ахуйн нэгж, Гурил үйлдвэрлэгч аж ахуй эрхлэгч.
Хүнсний боловсруулах үйлдвэр бүхий аж ахуйн нэгж, Гурил үйлдвэрлэгч аж ахуй эрхлэгч.
Сүү, махны чиглэлийн эрчимжсэн аж ахуй, гахай, тахиа, зөгийн аж ахуй эрхлэгч, тэжээлийн үйлдвэрлэл эрхлэгч..
Хөдөө аж ахуйн яамнаас ирүүлсэн зээл авах боломжит харилцагчийн жагсаалтад мэдээлэл нь орсон байх..
Шүүхийн хүчин төгөлдөр шийдвэрээр төлөх өр төлбөргүй байх..
Монгол Улсын холбогдох хуулийн дагуу үүсгэн байгуулагдаж, бүртгэгдсэн, Монгол Улсын нутаг дэвсгэрт сүүлийн 12 сараас доошгүй хугацаанд үйл ажиллагаа эрхэлж буй хуулийн этгээд байх..
Бусад нэмэлт шаардлага.."
https://www.xacbank.mn/product/1152,Бүрдүүлэх материал,"Хүнс, хөдөө аж ахуйн үйлдвэрлэлийг дэмжих эргэлтийн хөрөнгийн зээл","ИРГЭН:
No link found. Check URL: https://www.xacbank.mn/product/1152"
https://www.xacbank.mn/product/1153,Давуу тал,"Хүнс, хөдөө аж ахуйн үйлдвэрлэлийг дэмжих хөрөнгө оруулалтын зээл","Таны бизнесийн цар хүрээ, зээлжих чадвараас хамаарч зээлийн хэмжээг тогтооно..
Зээлийн үндсэн төлбөрөөс 12 хүртэл сараар чөлөөлнө.."
https://www.xacbank.mn/product/1153,Зээлийн зориулалт,"Хүнс, хөдөө аж ахуйн үйлдвэрлэлийг дэмжих хөрөнгө оруулалтын зээл","Дотоодын хүнс болон хөдөө аж ахуйн үйлдвэрлэл эрхэлдэг иргэн, хуулийн этгээд, хоршоодод хөрөнгө оруулалтын зориулалтаар шинээр олгох зээл.
No link found. Check URL: https://www.xacbank.mn/product/1153"
https://www.xacbank.mn/product/1153,Бүтээгдэхүүний нөхцөл,"Хүнс, хөдөө аж ахуйн үйлдвэрлэлийг дэмжих хөрөнгө оруулалтын зээл","5 тэрбум төгрөг хүртэл, 60 сар, 0.5%, 6.0%, 1%"
https://www.xacbank.mn/product/1153,Тавигдах шаардлага,"Хүнс, хөдөө аж ахуйн үйлдвэрлэлийг дэмжих хөрөнгө оруулалтын зээл","Газар тариалангийн үйлдвэрлэлийг дэмжих хөрөнгө оруулалтын зээл:Газар тариалангийн үйлдвэрлэлийнhttps://plant.mofa.gov.mn/цахим системд бүртгүүлж баталгаажуулсан байх.Улаан буудайн тариалан эрхэлдэг, үр тариа, тос, буурцагт болон тэжээл, төмсний үйлдвэрлэл эрхлэгч, 4 улирлын хүлэмжийн аж ахуй байгуулах, цагаан будаа, гурвалжин будаа, шар будаа, бог будаа, хөц будаа, хөх тариа, арвай, хүнсний хошуу будаа, чихрийн манжин тариалах, төмс, хүнсний ногооны зоорь, агуулахын аж ахуй байгуулах, эрхлэх аж ахуй нэгж, хоршоо, иргэнд олгох зээл.
Газар тариалангийн үйлдвэрлэлийнhttps://plant.mofa.gov.mn/цахим системд бүртгүүлж баталгаажуулсан байх..
Улаан буудайн тариалан эрхэлдэг, үр тариа, тос, буурцагт болон тэжээл, төмсний үйлдвэрлэл эрхлэгч, 4 улирлын хүлэмжийн аж ахуй байгуулах, цагаан будаа, гурвалжин будаа, шар будаа, бог будаа, хөц будаа, хөх тариа, арвай, хүнсний хошуу будаа, чихрийн манжин тариалах, төмс, хүнсний ногооны зоорь, агуулахын аж ахуй байгуулах, эрхлэх аж ахуй нэгж, хоршоо, иргэнд олгох зээл.
Хүнсний болон хүнсний зориулалтын сав, баглаа боодлын үйлдвэрлэлийг дэмжих хөрөнгө оруулалтын зээл:Жимс, хүнсний ногоо боловсруулах үйлдвэрлэл эрхлэгч, сүү, сүүн бүтээгдэхүүн үйлдвэрлэгч, хүүхдэд зориулсан хүнсний бүтээгдэхүүн боловсруулах үйлдвэрлэл эрхлэгч, сургууль, цэцэрлэгийн хүүхдийн хэрэглээнд зориулан хүнсний бүтээгдэхүүн үйлдвэрлэгч, давс олборлогч, үйлдвэрлэгч, төмс боловсруулж цардуул, төмсөн бүтээгдэхүүний үйлдвэр байгуулах, элсэн чихрийн боловсруулах үйлдвэр байгуулах, хүнсний түүхий эд, бүтээгдэхүүн, хоол үйлдвэрлэгч, хүнсний бүтээгдэхүүний худалдаа эрхлэгч, хүнсний түүхий эд, бүтээгдэхүүн тээвэрлэгч, газар тариалангийн үйлдвэрлэл эрхлэгч, сав, баглаа боодол үйлдвэрлэгч зэрэг аж ахуй нэгж, үйлдвэрлэгчид олгох зээл.
Жимс, хүнсний ногоо боловсруулах үйлдвэрлэл эрхлэгч, сүү, сүүн бүтээгдэхүүн үйлдвэрлэгч, хүүхдэд зориулсан хүнсний бүтээгдэхүүн боловсруулах үйлдвэрлэл эрхлэгч, сургууль, цэцэрлэгийн хүүхдийн хэрэглээнд зориулан хүнсний бүтээгдэхүүн үйлдвэрлэгч, давс олборлогч, үйлдвэрлэгч, төмс боловсруулж цардуул, төмсөн бүтээгдэхүүний үйлдвэр байгуулах, элсэн чихрийн боловсруулах үйлдвэр байгуулах, хүнсний түүхий эд, бүтээгдэхүүн, хоол үйлдвэрлэгч, хүнсний бүтээгдэхүүний худалдаа эрхлэгч, хүнсний түүхий эд, бүтээгдэхүүн тээвэрлэгч, газар тариалангийн үйлдвэрлэл эрхлэгч, сав, баглаа боодол үйлдвэрлэгч зэрэг аж ахуй нэгж, үйлдвэрлэгчид олгох зээл.
Шүүхийн хүчин төгөлдөр шийдвэрээр төлөх өр төлбөргүй байх..
Монгол Улсын холбогдох хуулийн дагуу үүсгэн байгуулагдаж, бүртгэгдсэн, Монгол Улсын нутаг дэвсгэрт сүүлийн 12 сараас доошгүй хугацаанд үйл ажиллагаа эрхэлж байгаа хуулийн этгээд байх..
ХАА-н яамнаас ирүүлсэн зээл авах боломжит харилцагчийн жагсаалтад мэдээлэл нь орсон байх..
Үйлдвэрийн барилга, байгууламж барих, өргөтгөх зориулалтаар хүсэлт гаргасан зээл хүсэгч нь үйлдвэрийн барилга, байгууламжийг төлөвлөх норм дүрэмд нийцэхүйц өөрийн эзэмшлийн өмчлөх, эзэмших эрхтэй газартай байх, зураг төсөл, төсөвтэй байх..
Хүнсний болон хүнсний зориулалтын сав, баглаа боодлын үйлдвэр байгуулах зорилгоор үйлдвэрлэлийн тоног төхөөрөмж худалдан авах, шинэчлэх зориулалтаар хүсэлт гаргасан зээл хүсэгч нь үйлдвэрлэлийн үйл ажиллагааг хэвийн эрхлэх өөрийн ажлын байртай байх..
Худалдан авах үйлдвэрлэлийн тоног төхөөрөмж нь худалдах, худалдан авах гэрээ, эсхүл нэхэмжлэх, гадаадаас орж ирсэн, шинэ тоног төхөөрөмжийн хувьд гаалийн баримт бичиг, тоног төхөөрөмжийн техникийн паспорт, үйлдвэрлэлийн гэрчилгээний хуулбартай, эд хөрөнгийн даатгалд даатгуулсан байх..
Бусад нэмэлт шаардлага.."
https://www.xacbank.mn/product/1153,Бүрдүүлэх материал,"Хүнс, хөдөө аж ахуйн үйлдвэрлэлийг дэмжих хөрөнгө оруулалтын зээл","ИРГЭН:
No link found. Check URL: https://www.xacbank.mn/product/1153"
