url,question,context,answer
https://www.xacbank.mn/product/1,Давуу тал:,Цалингийн зээл,"Хурдан шуурхай шийдвэрлэн олгодог..
Зээлийн хугацаанд нэмэлт санхүүжилтээр зээлийн хэмжээг нэмэгдүүлдэг.."
https://www.xacbank.mn/product/1,Бүтээгдэхүүний нөхцөл,Цалингийн зээл,"Зээлийн хэмжээ, 300,000 - 50,000,000 төгрөг, 300,000 төгрөгөөс дээш
Зээлийн хүү*, Сарын, 1.5%-1.9%, 1.5% - 1.8%
Жилийн, 18.0%-22.8%, 18.0% - 21.6%**
Зээлийн хугацаа, 30 сар
Үйлчилгээний шимтгэл, 0.5%, 1%"
https://www.xacbank.mn/product/1,Тавигдах шаардлага:,Цалингийн зээл,"Хуулийн этгээдэд 6 сараас доошгүй хугацаанд ажилласан, үндсэн ажилтан байх..
Зээлийн муу түүхгүй байх.."
https://www.xacbank.mn/product/1,Бүрдүүлэх материал:,Цалингийн зээл,"Хэрэглээний зээлийн өргөдөл (ХасБанкны салбараас эсхүлэнд даржтатаж авна уу)..
3х4 хэмжээний цээж зураг..
Иргэний үнэмлэх, түүний хуулбар..
Ажил олгогчийн тодорхойлолт..
Банкны зүгээс шаардлагатай гэж үзсэн бусад нэмэлт материал.."
https://www.xacbank.mn/product/102,Зээлийн нөхцөл:,Хүлэмжийн хийг бууруулах зорилгоор олгогдох бизнесийн зээл,"Зээлийн хүү, Бизнес эрхлэгчдэд, 1.25%, 15.00%, 0.85%, 10.20%, 1%, 0.5%
Зээлийн хугацаа, 5 хүртэл жил
Зээлийн нэмэлт шалгуур, 20% болон түүнээс дээш хувиар эрчим хүчийг хэмнэх эсхүл хүлэмжийн хийн ялгарлыг бууруулснаа баталгаажуулсан байх"
https://www.xacbank.mn/product/102,"Барьцаа, нөхцөл:",Хүлэмжийн хийг бууруулах зорилгоор олгогдох бизнесийн зээл,"Үл хөдлөх болон хөдлөх хөрөнгө, бусад..
Үндсэн төлбөрөөс чөлөөлөгдөх хугацаа 12 сар хүртэл.."
https://www.xacbank.mn/product/102,Бүрдүүлэх материал:,Хүлэмжийн хийг бууруулах зорилгоор олгогдох бизнесийн зээл,"ХасБанкны маягтын дагуу анкет..
Бизнесийн танилцуулга..
Хуулийн этгээдийн гэрчилгээ, дүрэм, үүсгэн байгуулсан гэрээ..
Санхүүгийн тайлан /1-2жил/..
Бизнесийн үйл ажиллагааны зөвшөөрөл, лиценз, патент..
Хүлэмжийн хийн ялгарал эсхүл эрчим хүчийг 20-с доошгүй хувиар бууруулж буйг баталсан сертификат эсхүл лабораторийн дүгнэлт зэрэг бичиг баримт /Зөвхөн тодорхой нэр төрлийн бүтээгдэхүүний хувьд*/..
Бусад банк санхүүгийн байгууллагаас авч байсан сүүлийн зээлийн түүх..
Зээлээр санхүүжүүлэх үйл ажиллагаатай холбоотой гэрээ хэлцэл..
Барьцаа хөрөнгөтэй холбоотой бичиг баримтууд..
Бусад.."
https://www.xacbank.mn/product/104,Төслийн зорилго:,"“ЖАЙКА” жижиг дунд үйлдвэрлэлийг дэмжих, байгаль орчныг хамгаалах II үе шаттай төсөл","Жижиг дунд үйлдвэрлэлийг дэмжих, байгаль орчныг хамгаалах, ядуурлыг бууруулахад зориулж 100 хувь үндсэн хөрөнгө санхүүжүүлнэ.
No link found. Check URL: https://www.xacbank.mn/product/104"
https://www.xacbank.mn/product/104,Зээлийн нөхцөл:,"“ЖАЙКА” жижиг дунд үйлдвэрлэлийг дэмжих, байгаль орчныг хамгаалах II үе шаттай төсөл","Зээлийн хэмжээ, 50,000,000 – 800,000,000 төгрөгтэй тэнцэх ам.доллар, 50,000,000 – 800,000,000 төгрөг
Зээлийн хүү /жилийн/, 10.27%, 7%
Зээлийн шимтгэл, 0.5%, 1%
Зээлийн хугацаа, 3-10 жил
Үндсэн төлбөрөөс чөлөөлөх хугацаа, 1-3 жил
Бусад, Банкны ерөнхий нөхцөл"
https://www.xacbank.mn/product/104,Тавигдах шаардага:,"“ЖАЙКА” жижиг дунд үйлдвэрлэлийг дэмжих, байгаль орчныг хамгаалах II үе шаттай төсөл","Төсөлтэй байх..
Нийт төслийн өртгийн 20%-г өөрөө санхүүжүүлэх..
Хөрөнгө оруулалтын өгөөж 13%-с өндөр байх..
Өрийн харьцаа 1.3-с их байх..
Байгаль орчны үнэлгээ хийлгэж дүгнэлт авсан байх..
20 сая төгрөгийн зээл тутамд 1 ажлын байр нэмэгдүүлэх..
Зээлийн муу түүхгүй байх.•Банкны шалгуурыг хангасан байх..
Зугаа цэнгэл, архи тамхи, цэрэг байлдаан, цөмийн үйл ажиллагаа дэмжихгүй..
Нийт ажилчдын тоо үйлдвэрлэлийн салбар бол 200-с хэтрэхгүй, үйлчилгээний салбар 50-с хэтрэхгүй..
Монгол талын хувийн өмч 51%-с дээш байх..
Банкны бусад шаардлага.."
https://www.xacbank.mn/product/104,Төслөөр санхүүжүүлэхгүй төслийн чиглэлүүд:,"“ЖАЙКА” жижиг дунд үйлдвэрлэлийг дэмжих, байгаль орчныг хамгаалах II үе шаттай төсөл","Нийгмийн ёс суртахуунд сөрөг нөлөө үзүүлэх бизнес..
Байгаль орчинд сөрөг нөлөөтэй бизнес..
Жижиглэн болон бөөний худалдааны бизнес..
Муу зээлийн түүхтэй бизнес..
Барилгын болон үл хөдлөх хөрөнгийн бизнес..
Хэрэглээний зээл..
Хувь хүний бизнес..
Уул уурхайн бизнес..
Архи тамхины бизнес.."
https://www.xacbank.mn/product/104,БҮРДҮҮЛЭХ БИЧИГ БАРИМТ,"“ЖАЙКА” жижиг дунд үйлдвэрлэлийг дэмжих, байгаль орчныг хамгаалах II үе шаттай төсөл","Чанарын өндөр түвшинд боловсруулсан төсөл..
Төслийн шалгуур хэсэгт заасан баримт бичгүүд..
Банкны бүрдүүлэх бичиг баримт..
Үндсэн хөрөнгийн зээлийн бүрдүүлэх бичиг баримтыг Энд дарж авна уу.."
https://www.xacbank.mn/product/109,Давуу тал:,Платинум карт (ВИЗА),"Монгол Улс болон гадаад оронд төлбөр тооцоогоо саадгүй гүйцэтгэх..
Та төгрөгийн дансаа ашиглаж гадаадад төлбөр, тооцоо гүйцэтгэх боломжтой бөгөөд энэ тохиолдолд гүйлгээ хийсэн валютын төрлөөс хамааран банк бэлэн бус ханшаар хөрвүүлэн тооцох болно..
Картын дансандаа барьцаа (дансны доод үлдэгдэл) байршуулах шаардлагагүй..
ХасБанкны харилцах дансаа картдаа холбуулж ашиглах..
Зээлийн эрх нээлгэх..
Хөнгөлөлттэй нөхцлөөр дэд карт нээлгэх..
Интернэт банк ашиглан картын дансаа 24 цаг хянах.."
https://www.xacbank.mn/product/109,Картын үйлчилгээний нөхцөл:,Платинум карт (ВИЗА),"Жилийн хураамж, 300,000 төг
Өдөрт зарлагадах бэлэн мөнгөний дээд хязгаар, 20,000,000 төг
Худалдан авалтын гүйлгээний дээд хязгаар, 20,000,000 төг
Карт нөхөн авах, -
ПИН код нөхөн авах, -
Дэд карт эзэмшигчийн жилийн хураамж, 50,000 төг
Бэлэн мөнгө авах, ХасБанкны АТМ, 0₮
Гадаадын банкнаас /АТМ/, 1.5% (хамгийн багадаа 3.000₮)
ХасБанкны салбараас ам.доллар авах, 0.25%
ХасБанкны салбараас төгрөг авах, 200₮
АТМ дээр дансны үлдэгдэл шалгах, ХасБанкны АТМ, 0₮
Дотоодын бусад банк, 200₮
Гадаадын АТМ, 1000₮ буюу тэнцэхүйц валют"
https://www.xacbank.mn/product/109,Бүрдүүлэх материал:,Платинум карт (ВИЗА),"Монгол улсын иргэн бол - иргэний үнэмлэх эсхүл гадаад паспорт..
Гадаадын иргэн бол - түр оршин суух үнэмлэх.."
https://www.xacbank.mn/product/111,Корреспондент банкнуудын жагсаалт,Корреспондент банкууд,"Олон улсын хоригт орсон иргэн, аж ахуйн нэгжрүү гүйлгээ шилжүүлэх эсвэл гүйлгээ хүлээн авахгүй байхыг ХасБанкны зүгээс онцгойлон анхааруулж байна.
No link found. Check URL: https://www.xacbank.mn/product/111"
https://www.xacbank.mn/product/113,Давуу тал,КҮБ буюу ПОС Төхөөрөмжийн үйлчилгээ,"Олон улсын VISA, UPI болон дотоодын банкуудын бүх картуудыг уншина..
1800-1888 лавлах дугаараар 24 цагийн турш санал хүсэлт хүлээн авч шуурхай шийдвэрлэнэ..
ХасБанкны карт эзэмшигчдэд бэлэн мөнгө олгох CASHBACK үйлчилгээг үзүүлж бизнесийн орлогоо нэмэгдүүлэх боломжтой. CASHBACK үйлчилгээний талаар дэлгэрэнгүй мэдээлэл авахыг хүсвэл ЭНД дарна уу.."
https://www.xacbank.mn/product/113,ҮЙЛЧИЛГЭЭНИЙ НӨХЦӨЛ,КҮБ буюу ПОС Төхөөрөмжийн үйлчилгээ,"Карт уншигч ПОС төхөөрөмж, ҮНЭГҮЙ
ПОС-ын цаас болон дагалдах хэрэгсэл, ҮНЭГҮЙ
Гарын авлага, сурталчилгааны материал, ҮНЭГҮЙ"
https://www.xacbank.mn/product/113,БҮРДҮҮЛЭХ БИЧИГ БАРИМТ,КҮБ буюу ПОС Төхөөрөмжийн үйлчилгээ,"Бүртгүүлэх хүсэлтийн маягт /ХасБанкны маягт/..
Иргэн бол иргэний үнэмлэхний хуулбар..
Хуулийн этгээд Аж ахуйн нэгжийн гэрчилгээний хуулбар.."
https://www.xacbank.mn/product/113,Хураамж шимтгэлийн нөхцөл,КҮБ буюу ПОС Төхөөрөмжийн үйлчилгээ,"Дотоод банкуудын карт – 1%.
Гадаадын банкны карт – 3%."
https://www.xacbank.mn/product/1136,Давуу тал:,Тэмүүлэл дэд карт,"Нийтийн тээвэрт хүүхдийн тарифаар зорчих..
Дижитал банкаар карт болон дансаа удирдах..
ХасБанкны АТМ-ээс бэлэн мөнгө авах, ХасБанкны дансруу шилжүүлэг хийхэд шимтгэлгүй..
Интернэт худалдааны вэб сайтуудаас худалдан авалт хийх..
Гадаад, дотоодод төлбөр тооцоогоо хурдан, шуурхай, найдвартай гүйцэтгэх..
Бэлэн бус төлбөр тооцоог шимтгэлгүй гүйцэтгэх..
Орчин үеийн өндөр нууцлал бүхий чип технологитой..
Интернэт худалдан авалтын давхар хамгаалалттай бөгөөд таны гүйлгээ бүр нууц кодоор баталгаажина.."
https://www.xacbank.mn/product/1136,Картын үйлчилгээний нөхцөл:,Тэмүүлэл дэд карт,"Карт эзэмшигчид тавигдах шаардлага, Тэмүүлэл дэд карт 07-13 настай харилцагчид эцэг эх, асран хамгаалагчийн дансанд захиална
Картын төрөл, VISA
Дансны валют, MNT
Хүчинтэй хугацаа, 5 жил
Жилийн хураамж, 10,000 төг
Өдөрт зарлагадах бэлэн мөнгөний дээд хязгаар, 100,000 төг
Худалдан авалтын гүйлгээний дээд хязгаар, 500,000 төг
Карт нөхөн авах, 5,000 төг
Пин код шинээр авах /Дижитал банкаар/, 1,000 төг
Пин код солих /АТМ/, 0 төг
Бэлэн мөнгө авах, ХасБанкны АТМ, 0₮
Гадаадын банкнаас /АТМ/, 1.5% (Багадаа 3,000₮)
ХасБанкны салбараас ам.доллар авах, 0.25%
ХасБанкны салбараас төгрөг авах, 200₮
АТМ дээр дансны үлдэгдэл шалгах, ХасБанкны АТМ, 0₮
Дотоодын бусад банк, 200₮
Гадаадын АТМ, 1000₮ буюу тэнцэхүйц валют"
https://www.xacbank.mn/product/1136,Бүрдүүлэх материал:,Тэмүүлэл дэд карт,"Хүүхдийн төрсний гэрчилгээ болон эцэг эхийн аль нэгнийх нь иргэний үнэмлэх..
Гадаадын иргэн бол гадаад паспорт, түр оршин суух үнэмлэх."
https://www.xacbank.mn/product/1137,Давуу тал:,Энгийн кредит карт,"Дэлхийн хаана ч ашиглах боломжтой кредит карт..
Сар бүр дэлгэрэнгүй төлбөрийн нэхэмжлэхээ интернэт банкаар харах..
ХасИнфо буюу мессежээр гүйлгээ мэдэгдэх үйлчилгээ үнэгүй авна..
Төлбөр төлөх өдөр нийт нэхэмжилсэн дүнг бүрэн төлбөл худалдан авалтын хүүгээс чөлөөлөгдөх боломжтой.."
https://www.xacbank.mn/product/1137,Бүтээгдэхүүнийн нөхцөл,Энгийн кредит карт,"Дансны валют, Төгрөг
Жилийн хураамж, 30,000 төг
Зээлийн эрхийн дээд хэмжээ, 5,000,000 төг
Зээлийн эрхийн доод хэмжээ, 500,000 төг
Худалдан авалтын гүйлгээний хүү, 1.8% /сарын/, 21.6% /жилийн/
Бэлэн мөнгөний гүйлгээний хүү /сар/, 2.0% /сарын/, 24% /жилийн/"
https://www.xacbank.mn/product/1137,Кредит карт хэрхэн авах вэ?,Энгийн кредит карт,"Та өөрт ойр ХасБанкны салбарт хандан зээлийн мэргэжилтэнтэй уулзана уу.
No link found. Check URL: https://www.xacbank.mn/product/1137"
https://www.xacbank.mn/product/1138,Давуу тал:,Алтан кредит карт,"Дэлхийн хаана ч ашиглах боломжтой кредит карт..
Сар бүр дэлгэрэнгүй төлбөрийн нэхэмжлэхээ интернэт банкаар харах..
ХасИнфо буюу мессежээр гүйлгээ мэдэгдэх үйлчилгээ үнэгүй авна..
Төлбөр төлөх өдөр нийт нэхэмжилсэн дүнг бүрэн төлбөл худалдан авалтын хүүгээс чөлөөлөгдөх боломжтой.."
https://www.xacbank.mn/product/1138,Бүтээгдэхүүнийн нөхцөл,Алтан кредит карт,"Дансны валют, Төгрөг
Жилийн хураамж, 100,000 төг
Зээлийн эрхийн дээд хэмжээ, 15,000,000 төг
Зээлийн эрхийн доод хэмжээ, 5,000,001 төг
Худалдан авалтын гүйлгээний хүү, 1.7% /сарын/, 20,4% /жилийн/
Бэлэн мөнгөний гүйлгээний хүү /сар/, 2.0% /сарын/, 24% /жилийн/"
https://www.xacbank.mn/product/1138,Кредит карт хэрхэн авах вэ?,Алтан кредит карт,"Та өөрт ойр ХасБанкны салбарт хандан зээлийн мэргэжилтэнтэй уулзана уу.
No link found. Check URL: https://www.xacbank.mn/product/1138"
https://www.xacbank.mn/product/1139,Давуу тал:,Платинум кредит карт,"Дэлхийн хаана ч ашиглах боломжтой кредит карт..
Сар бүр дэлгэрэнгүй төлбөрийн нэхэмжлэхээ интернэт банкаар харах..
ХасИнфо буюу мессежээр гүйлгээ мэдэгдэх үйлчилгээ үнэгүй авна..
Төлбөр төлөх өдөр нийт нэхэмжилсэн дүнг бүрэн төлбөл худалдан авалтын хүүгээс чөлөөлөгдөх боломжтой..
Үнэгүй аяллын даатгал.."
https://www.xacbank.mn/product/1139,Бүтээгдэхүүнийн нөхцөл,Платинум кредит карт,"Дансны валют, Төгрөг
Жилийн хураамж, 300,000 төг
Зээлийн эрхийн дээд хэмжээ, 100,000,000 төг
Зээлийн эрхийн доод хэмжээ, 15,000,001 төг
Худалдан авалтын гүйлгээний хүү, 1.5% /сарын/, 18% /жилийн/
Бэлэн мөнгөний гүйлгээний хүү /сар/, 2.0% /сарын/, 24% /жилийн/"
https://www.xacbank.mn/product/1139,Кредит карт хэрхэн авах вэ?,Платинум кредит карт,"Та өөрт ойр ХасБанкны салбарт хандан зээлийн мэргэжилтэнтэй уулзана уу.
No link found. Check URL: https://www.xacbank.mn/product/1139"
https://www.xacbank.mn/product/1140,Бүтээгдэхүүний нөхцөл,Агаар орчны бохирдлыг бууруулахад чиглэсэн Хэрэглээний Ногоон Зээл,"50 сая төгрөг хүртэл, 30 сар, 6%, Зээл олголтын дүнгийн 1%"
https://www.xacbank.mn/product/1140,ТАВИГДАХ ШААРДЛАГА,Агаар орчны бохирдлыг бууруулахад чиглэсэн Хэрэглээний Ногоон Зээл,"Сүүлийн 12 сарын хугацаанд ажил, бизнес тогтвортой эрхэлсэн байх..
Зээлийн муу түүхгүй байх.."
https://www.xacbank.mn/product/1140,Бүрдүүлэх бичиг баримт,Агаар орчны бохирдлыг бууруулахад чиглэсэн Хэрэглээний Ногоон Зээл,"Хэрэглээний зээлийн өргөдөл (ХасБанкны салбараас эсхүл энд дарж татаж авна уу)..
3х4 хэмжээтэй цээж зураг..
Зээл хүсэгч болон өрхийн гишүүдийн иргэний үнэмлэх, түүний хуулбар..
Худалдан авах гэж буй тоног төхөөрөмжийн үнийн нэхэмжлэл/худалдах худалдан авах гэрээ..
Банкны зүгээс шаардлагатай гэж үзсэн бусад нэмэлт материал.."
https://www.xacbank.mn/product/1140,зориулалт,Агаар орчны бохирдлыг бууруулахад чиглэсэн Хэрэглээний Ногоон Зээл,"Эрчим хүчний хэмнэлттэй цахилгаан халаагуур, Зөөврийн болон хананд суурилуулах конвектор, дулаан нөөцлөх, хэт улаан туяа, уян, эрдэс чулуун бүрхүүлтэй, нано зэрэг эрчим хүчний хэмнэлттэй бүх төрлийн цахилгаан халаагуур, индукцийн аргаар утааны тоосонцрыг бүрэн шатаагч /Тохирлын гэрчилгээ, үйлдвэрлэгч байгууллагын тодорхойлолт, гал ус, чийг тэсвэрлэлтийн мэргэжлийн байгууллагын дүгнэлт
Дулаалгын материал, Орон сууц, байшин, Монгол гэрийн бүх төрлийн дулаалга
Гэр хорооллын нүхэн жорлон, Нэвчилтгүй нүхэн жорлон, бүх төрлийн био жорлон /MNS 5924:2015 стандартын  шаардлага хангасан дахин төлөвлөлтөд хамрагдахгүй газар байх/
Бага оврын цэвэрлэх байгууламж, Амины орон сууцны зориулалттай ахуйн бохир ус цэвэрлэх бага оврын цэвэрлэх байгууламж /MNS4288:1995, MNS 4943:2015, MNS EN12566-3:2011 стандартын шаардлага  хангасан байх/
Гэрийн сайжруулсан зуух, Ахуйн хэрэглээний зуух  MNS 5216:2016  EN13240  стандартын  шаардлага  хангасан/
Цахилгаан тээврийн хэрэгсэл, Цахилгаан машин,  цахилгаан мотоцикл, цахилгаан скүтер (Scooter), бүх төрлийн унадаг дугуй /Цахилгаан машин 2014 оноос хойш үйлдвэрлэсэн, 100 хувь цахилгаан хөдөлгүүртэй, батарей  ашиглалт 75 хувиас  буураагүй байх/
Сэргээгдэх эрчим хүчний эх үүсвэр, Ахуйн хэрэглээний зориулалттай агаар, нар, салхин станц, дулааны насос зэрэг бүх төрлийн сэргээгдэх эрчим хүчний эх үүсвэр
Хувийн орон сууцыг инженерийн шугам сүлжээнд холбох, Инженерийн шугам сүлжээ, барилга байгууламж бүхий стандартын шаардлагад нийцсэн цахилгаан, дулааны эх үүсвэр болон  цэвэр, халуун усаар хангах, бохир ус татан зайлуулах төвлөрсөн системд  хувийн орон сууцыг холбох
Хийн халаалт, Нүүрсээр ажилладаг зуухыг шинэчилж хийн зуухаар солих
Утаа шүүх яндан, яндангийн нэмэлт тоноглол, Уурын зуух, нам даралтын халаалтын зуух, гэрийн зуухнаас гарах бохирдлыг бууруулах яндан."
https://www.xacbank.mn/product/1141,Нөхцөл:,Агаар орчны бохирдлыг бууруулахад чиглэсэн  Бизнесийн Ногоон Зээл,"Зээлийн хэмжээ, 300,000 – 30 сая төгрөг, 30.1-200 сая төгрөг
Валютын төрөл, Төгрөг
Зээлийн хүү, Жилийн 8%
Зээлийн хугацаа, 3-36 сар, 3-60 сар
Үйлчилгээний шимтгэл, 5 сая төгрөг хүртэл – 0.5%5 сая төгрөгөөс дээш – 1%
Зээлийн өргөдлийн хураамж, 0 төргрөг"
